{
  "schemaVersion": "musubi.publication.public-payload-manifest.v1",
  "payloadCommit": "df8c869425ed5c21c1e387d869503c9056bea4bc",
  "payloadGitTreeOid": "d773d1898b8d2dc4ccae04e727381e0351dec217",
  "payloadTreeDigest": "sha256:c764fdcc2accbbffc82eadec1770c8b4d1d01ee833a5939fd0a4d8692287a2b5",
  "treeDigestSpecVersion": "musubi-content-mode-tree-v1",
  "coveragePolicy": "ALL_PAYLOAD_COMMIT_FILES_EXCLUDING_THIS_AND_RELEASE_MANIFEST",
  "fileCount": 839,
  "files": [
    {
      "path": ".github/workflows/ci.yml",
      "contentDigest": "sha256:3fc13e7b70098f5cf683fd621cdd72132da59491d3f73002e3dbd87a2b3afdea",
      "mode": "100644"
    },
    {
      "path": ".gitignore",
      "contentDigest": "sha256:10e19d72ae794ab9409ec17b5eda143fb99c7b5ed0a4bd70d094c690e94b389a",
      "mode": "100644"
    },
    {
      "path": "AGENTS.md",
      "contentDigest": "sha256:08fc281874dcc5f51b25e6c15c5a65ff048595d10336571a0eb0834d633fb462",
      "mode": "100644"
    },
    {
      "path": "CHANGELOG.md",
      "contentDigest": "sha256:0bbc883a6b4c86d74b419072439fdc75a89b05dcfd21002a6478ca31f61391ea",
      "mode": "100644"
    },
    {
      "path": "CODE_OF_CONDUCT.md",
      "contentDigest": "sha256:245d918481b379671a37848f2867263319a1d2b6ef93f91ba82c8df026e0ae6e",
      "mode": "100644"
    },
    {
      "path": "CONTRIBUTING.md",
      "contentDigest": "sha256:768180544559382524779c92684c6ceaea5f1e7dfe21796f8c0a837b71171659",
      "mode": "100644"
    },
    {
      "path": "Cargo.lock",
      "contentDigest": "sha256:4be1a2b850f0e2dcdceae955992a7628ef7ccc38709494e0d7e530fbc1e49cae",
      "mode": "100644"
    },
    {
      "path": "Cargo.toml",
      "contentDigest": "sha256:7016f512e51da5879beb1dc0f26e23b0aff58c2de0709317021c8554ed4f21c6",
      "mode": "100644"
    },
    {
      "path": "LICENSE",
      "contentDigest": "sha256:7ed699fe9e8b571355e5eabd72a707e15432bd38d61364926181a0b719538435",
      "mode": "100644"
    },
    {
      "path": "NOTICE",
      "contentDigest": "sha256:3b6065baf7228616152b2c2cd4860fb0c683c84284c61d231f1023175b9c9b17",
      "mode": "100644"
    },
    {
      "path": "README.md",
      "contentDigest": "sha256:42817ccfb89102f4b4fbdd1361463d7bd34f533a2385035ee652701006d7ca77",
      "mode": "100644"
    },
    {
      "path": "SECURITY.md",
      "contentDigest": "sha256:c59d2c3a93285e6d07ad72ef78049a60ee394846bd2917faa945211168f2b902",
      "mode": "100644"
    },
    {
      "path": "SUPPORT.md",
      "contentDigest": "sha256:5d7b0ef4c1ea3252a5fe295b01e28e2189618055c56045f2f013488a462c789b",
      "mode": "100644"
    },
    {
      "path": "crates/adapter-spi/Cargo.toml",
      "contentDigest": "sha256:42882e82ffd492f64ce12f93a317435ea33405b024e872a5aab75c4a86f1085f",
      "mode": "100644"
    },
    {
      "path": "crates/adapter-spi/README.md",
      "contentDigest": "sha256:c69fb709d24a8c5fc8edba8884685b02ecffb429910749fcaabfab05969e80f4",
      "mode": "100644"
    },
    {
      "path": "crates/adapter-spi/examples/ingest_recorded_csv.rs",
      "contentDigest": "sha256:c12cc9ac6e2c3c8a4f43768d0317a0f6847612461d5834a92bd9f7205d613754",
      "mode": "100644"
    },
    {
      "path": "crates/adapter-spi/examples/ingest_recorded_jsonl.rs",
      "contentDigest": "sha256:ccf278191f3ea1d6af9d60f9a42868e3aa6d9149564476139199b16ee8cca3e1",
      "mode": "100644"
    },
    {
      "path": "crates/adapter-spi/examples/ingest_recorded_observations.rs",
      "contentDigest": "sha256:055260f9859a6dc4d1cc89c58eb8850d17c6560a5219efad7aede556c3ac448d",
      "mode": "100644"
    },
    {
      "path": "crates/adapter-spi/src/lib.rs",
      "contentDigest": "sha256:aa28398f719548f282264b7543d8af88811f09377049a936b00bd10a44e900f9",
      "mode": "100644"
    },
    {
      "path": "crates/adapter-spi/src/recorded_csv.rs",
      "contentDigest": "sha256:4ba8b34af955eff1db8b43887782c3e10565514f03e8b700b7abd6fbcc62fce1",
      "mode": "100644"
    },
    {
      "path": "crates/adapter-spi/src/recorded_jsonl.rs",
      "contentDigest": "sha256:0aad011db59b95888510578b570f80be6136adbd84fa180612ec1e6021a3ddc2",
      "mode": "100644"
    },
    {
      "path": "crates/adapter-spi/src/recorded_observations.rs",
      "contentDigest": "sha256:14ebb6ebd8db33969138a223f5df7ccd333c0e66cd2c95fa66bb9a60f5a0b28d",
      "mode": "100644"
    },
    {
      "path": "crates/adapter-spi/src/spi.rs",
      "contentDigest": "sha256:5d7e93de1ecf2b01599068cf6bb7c123b4fc122e4e3cff06cc8ab5a1bab45ef9",
      "mode": "100644"
    },
    {
      "path": "crates/adapter-spi/src/spi_tests.rs",
      "contentDigest": "sha256:58f347db6971758b00dc0066aaff93a77415d17ed77a349280bae5c2d6ca4331",
      "mode": "100644"
    },
    {
      "path": "crates/adapter-spi/src/template.rs",
      "contentDigest": "sha256:a3e465a7391ca3cd37ffba0a3ba6498ad4d3f3b2eb3a4501c3c4877c01135d34",
      "mode": "100644"
    },
    {
      "path": "crates/adapter-spi/src/template_tests.rs",
      "contentDigest": "sha256:89db03737df5bba221d67c9f512fd50889cd4f9e5d12164ec9dd6c3f1a775db0",
      "mode": "100644"
    },
    {
      "path": "crates/adapter-spi/tests/recorded_channels.rs",
      "contentDigest": "sha256:de4e604c8f0abce4c90af0fbf3508783a394bc885237712562f40cf411a0de87",
      "mode": "100644"
    },
    {
      "path": "crates/adapter-spi/tests/recorded_csv.rs",
      "contentDigest": "sha256:81da1bf1f42721166ab8b6d720548d89de279020e8bcf54fd15499d0d090eeb7",
      "mode": "100644"
    },
    {
      "path": "crates/adapter-spi/tests/recorded_jsonl.rs",
      "contentDigest": "sha256:48ed2c9765e5bd6bb88c1c35c87cbd28e3af676e8fbec4fac0ef56cb098fc2c4",
      "mode": "100644"
    },
    {
      "path": "crates/civil-reference-pack/Cargo.toml",
      "contentDigest": "sha256:35b32b94674291ef74f45ee7f9b065160396efd8357a0b04f1e78a978e4493ba",
      "mode": "100644"
    },
    {
      "path": "crates/civil-reference-pack/src/consumers.rs",
      "contentDigest": "sha256:51635dd9397d8957b2cbc12eb61e3e0fd99877e282203da9fe13f9d65249f0e7",
      "mode": "100644"
    },
    {
      "path": "crates/civil-reference-pack/src/lib.rs",
      "contentDigest": "sha256:f995d8be7e3da3d7a837c1028f072dcb51c23d707b8b509dc9b8705be3010e3c",
      "mode": "100644"
    },
    {
      "path": "crates/civil-reference-pack/src/pack.rs",
      "contentDigest": "sha256:03d38d02a5d95d9c8ddf3cc36f37b8969eeff7d4acb571c3d9455ca3eadf3959",
      "mode": "100644"
    },
    {
      "path": "crates/civil-reference-pack/src/pack_tests.rs",
      "contentDigest": "sha256:5e23b93b12c0023594ee60783809c8fea3da4e8f27e07b45dee5035992e64e10",
      "mode": "100644"
    },
    {
      "path": "crates/civil-reference-pack/src/sources.rs",
      "contentDigest": "sha256:2a84f740f8cbb98ee9ada5a531e91763d72d92f331c4a2cac8762b3d52ed8a53",
      "mode": "100644"
    },
    {
      "path": "crates/civil-reference-pack/src/synth.rs",
      "contentDigest": "sha256:fa6579e20d760b3561711e7bbd22566c2986e7b9e97e220005a66b337ff9c26e",
      "mode": "100644"
    },
    {
      "path": "crates/conformance/Cargo.toml",
      "contentDigest": "sha256:8dd7996fb955d883a40a013989c8d6005a7f106220a88a3c2a1632604b978972",
      "mode": "100644"
    },
    {
      "path": "crates/conformance/src/harness.rs",
      "contentDigest": "sha256:47e07e7f5ecb204b8beff9e759d5b6fb447ce4a39d10538252130475cbe79773",
      "mode": "100644"
    },
    {
      "path": "crates/conformance/src/lib.rs",
      "contentDigest": "sha256:3820bd29ee90bdcafe5a46f6aa95524de3a2af222e97c642823013f05d5051c8",
      "mode": "100644"
    },
    {
      "path": "crates/core/Cargo.toml",
      "contentDigest": "sha256:3fe278111cd39160851adc0dbc43f6bbc6b2d4b115aceaba4a43f484e7b028b5",
      "mode": "100644"
    },
    {
      "path": "crates/core/src/ddil.rs",
      "contentDigest": "sha256:f0f0e9ed05e1bbe484e3d490de1e0b6414461838fb32ae5b50bcad4e5f141f91",
      "mode": "100644"
    },
    {
      "path": "crates/core/src/lib.rs",
      "contentDigest": "sha256:7821ac78ccbac625457d15fa14db614010106db9651874084af19f36b3611e32",
      "mode": "100644"
    },
    {
      "path": "crates/core/src/quarantine.rs",
      "contentDigest": "sha256:10df80ace0a0c8d3a550f539a0842df723c44a02c938e5d3c5f3e738d619e3f6",
      "mode": "100644"
    },
    {
      "path": "crates/core/src/store_and_forward.rs",
      "contentDigest": "sha256:f5fafceacfb87e087eba1f115bb4bad56fec2a2f235f76f6052acd50f814a47d",
      "mode": "100644"
    },
    {
      "path": "crates/core/src/vector_clock.rs",
      "contentDigest": "sha256:a48cfd8b2ad4f0f1103ef6fe80a9bd19ee23fd611764d07fb7229d9ca1a4353e",
      "mode": "100644"
    },
    {
      "path": "crates/decoded-csv/Cargo.toml",
      "contentDigest": "sha256:ab573163de4610e5526c32680959817b400bd84a168fe4fb01162eec708e6465",
      "mode": "100644"
    },
    {
      "path": "crates/decoded-csv/README.md",
      "contentDigest": "sha256:527ffbd50fb3270a36f2e80eb83dae57c2de455837d747ffb9f0c93df5fa8aab",
      "mode": "100644"
    },
    {
      "path": "crates/decoded-csv/examples/inspect.rs",
      "contentDigest": "sha256:a571d4398ae3c888f45d7236189449b05e709300e830e7195367e79bbe731028",
      "mode": "100644"
    },
    {
      "path": "crates/decoded-csv/examples/inspect_pose_csv.rs",
      "contentDigest": "sha256:3f4a1f7293f880f6fa77f3917fe4ff3252a7f06b6621a34258e73a4d2e2aac03",
      "mode": "100644"
    },
    {
      "path": "crates/decoded-csv/src/lib.rs",
      "contentDigest": "sha256:22962b614f9ecd3ddc8299f73b9e2a021a242e46e16307012242b672504a5a9b",
      "mode": "100644"
    },
    {
      "path": "crates/decoded-csv/tests/equal_time.rs",
      "contentDigest": "sha256:b50e53a987779124c740b2c5f0d0934241b5a2f7923ab2b4e341c544988b5a40",
      "mode": "100644"
    },
    {
      "path": "crates/decoded-csv/tests/nonfinite_text.rs",
      "contentDigest": "sha256:78216c601ba02568e0a038b8989603ec9027ea36055bc61c0412a15a4d4b4dbc",
      "mode": "100644"
    },
    {